[
  {
    "name": "Hyperpost",
    "url": "https://example.com",
    "avatar": "https://example.com/avatar.png",
    "description": "A demo friend link for the auto review workflow.",
    "rss": "https://example.com/feed.xml",
    "source": "manual",
    "createdAt": "2026-08-26T00:00:00.000Z"
  },
  {
    "name": "Kayin's Blog",
    "url": "https://far.smatrix.top",
    "description": "测试用介绍",
    "source": "submitted",
    "createdAt": "2026-08-26T13:48:57.417Z",
    "avatar": "https://bu.dusays.com/2026/08/08/6a76e139b3c50.jpeg"
  }
]
